{
  "$schema": "https://json-schema.org/draft/2020-12/schema",
  "$id": "factory-vision-learning-registry.schema.json",
  "title": "Factory Vision Learning Registry",
  "type": "object",
  "required": [
    "schema_version",
    "artifact_root",
    "policy",
    "cases"
  ],
  "properties": {
    "schema_version": { "const": "factory-vision-learning-registry-v2" },
    "created_at": { "type": "string" },
    "updated_at": { "type": "string" },
    "artifact_root": { "type": "string", "minLength": 1 },
    "policy": {
      "type": "object",
      "required": [
        "runtime_count_authority",
        "teacher_label_default_tier",
        "validation_truth_rule",
        "cloud_upload_default"
      ],
      "properties": {
        "runtime_count_authority": { "const": "yolo_event_app_path_only" },
        "teacher_label_default_tier": { "const": "bronze_pending" },
        "validation_truth_rule": { "const": "reviewed_gold_truth_required" },
        "cloud_upload_default": { "const": "forbidden_without_explicit_permission" }
      }
    },
    "cases": {
      "type": "array",
      "items": {
        "type": "object",
        "required": [
          "case_id",
          "aliases",
          "source_video",
          "status",
          "privacy_mode",
          "manifest_path",
          "learning_outcome",
          "readiness",
          "best_next_action",
          "commands",
          "do_not_trust",
          "related_cases",
          "evidence_refs",
          "dataset_export",
          "trust_boundaries",
          "blocked_reasons"
        ],
        "properties": {
          "case_id": { "type": "string", "minLength": 1 },
          "aliases": {
            "type": "array",
            "items": { "type": "string", "minLength": 1 },
            "uniqueItems": true
          },
          "source_video": {
            "type": "object",
            "required": ["path", "sha256"],
            "properties": {
              "path": { "type": "string", "minLength": 1 },
              "artifact_copy": { "type": ["string", "null"] },
              "sha256": {
                "type": "string",
                "pattern": "^[a-f0-9]{64}$"
              },
              "duration_sec": { "type": ["number", "null"], "minimum": 0 }
            }
          },
          "status": {
            "type": "string",
            "enum": [
              "learning_candidate",
              "failed_diagnostic",
              "diagnostic_recovered",
              "training_candidate",
              "verified_app_proof",
              "promotion_blocked"
            ]
          },
          "privacy_mode": {
            "type": "string",
            "enum": [
              "offline_local",
              "cloud_assisted_setup",
              "cloud_assisted_audit"
            ]
          },
          "manifest_path": { "type": "string", "minLength": 1 },
          "learning_outcome": { "type": "object" },
          "readiness": {
            "type": "object",
            "required": ["runtime", "validation", "training", "promotion"],
            "properties": {
              "runtime": { "type": "string", "minLength": 1 },
              "validation": { "type": "string", "minLength": 1 },
              "training": { "type": "string", "minLength": 1 },
              "promotion": { "type": "string", "minLength": 1 }
            }
          },
          "best_next_action": { "type": "string", "minLength": 1 },
          "commands": {
            "type": "array",
            "items": { "$ref": "#/$defs/command_ref" }
          },
          "do_not_trust": {
            "type": "array",
            "items": { "type": "string", "minLength": 1 }
          },
          "related_cases": {
            "type": "array",
            "items": {
              "type": "object",
              "required": ["case_id", "relation", "reason"],
              "properties": {
                "case_id": { "type": "string", "minLength": 1 },
                "relation": { "type": "string", "minLength": 1 },
                "reason": { "type": "string", "minLength": 1 }
              }
            }
          },
          "evidence_refs": {
            "type": "array",
            "items": { "$ref": "#/$defs/evidence_ref" }
          },
          "dataset_export": { "$ref": "#/$defs/dataset_export" },
          "trust_boundaries": { "$ref": "#/$defs/trust_boundaries" },
          "blocked_reasons": {
            "type": "array",
            "items": { "type": "string", "minLength": 1 }
          }
        }
      }
    }
  },
  "$defs": {
    "artifact_affects": {
      "type": "array",
      "items": {
        "type": "string",
        "enum": ["runtime", "validation", "training", "promotion", "review", "dataset_export"]
      }
    },
    "command_ref": {
      "type": "object",
      "required": ["label", "command", "prerequisites"],
      "properties": {
        "label": { "type": "string", "minLength": 1 },
        "command": { "type": "string", "minLength": 1 },
        "prerequisites": {
          "type": "array",
          "items": {
            "type": "object",
            "required": ["path", "required", "affects"],
            "properties": {
              "path": { "type": "string", "minLength": 1 },
              "required": { "type": "boolean" },
              "affects": { "$ref": "#/$defs/artifact_affects" },
              "warn_if_missing": { "type": "boolean" }
            }
          }
        }
      }
    },
    "dataset_export": {
      "type": "object",
      "required": ["state", "checks"],
      "properties": {
        "state": { "type": "string", "enum": ["ready", "blocked", "not_applicable"] },
        "path": { "type": ["string", "null"] },
        "checks": {
          "type": "array",
          "items": {
            "type": "object",
            "required": ["id", "status"],
            "properties": {
              "id": { "type": "string", "minLength": 1 },
              "status": { "type": "string", "enum": ["pass", "blocked", "not_applicable"] },
              "reason": { "type": ["string", "null"] }
            }
          }
        }
      }
    },
    "evidence_ref": {
      "type": "object",
      "required": [
        "artifact_id",
        "artifact_type",
        "path",
        "authority",
        "runtime_observation_allowed",
        "validation_truth_eligible",
        "training_eligible",
        "promotion_eligible",
        "affects"
      ],
      "properties": {
        "artifact_id": { "type": "string", "minLength": 1 },
        "artifact_type": { "type": "string", "minLength": 1 },
        "path": { "type": "string", "minLength": 1 },
        "authority": {
          "type": "string",
          "enum": [
            "canonical_proof",
            "supporting_regression",
            "diagnostic",
            "review_scaffold",
            "teacher_suggestion",
            "training_artifact"
          ]
        },
        "runtime_observation_allowed": { "type": "boolean" },
        "validation_truth_eligible": { "type": "boolean" },
        "training_eligible": { "type": "boolean" },
        "promotion_eligible": { "type": "boolean" },
        "must_exist": { "type": "boolean" },
        "affects": { "$ref": "#/$defs/artifact_affects" },
        "notes": { "type": ["string", "null"] }
      }
    },
    "trust_boundaries": {
      "type": "object",
      "required": [
        "runtime_observation_allowed",
        "validation_truth_eligible",
        "training_eligible",
        "promotion_eligible"
      ],
      "properties": {
        "runtime_observation_allowed": { "type": "boolean" },
        "validation_truth_eligible": { "type": "boolean" },
        "training_eligible": { "type": "boolean" },
        "promotion_eligible": { "type": "boolean" }
      }
    }
  }
}
