{
  "artifact_root": "/Users/thomas/FactoryVisionArtifacts",
  "cases": [
    {
      "aliases": ["factory2"],
      "best_next_action": "Use Factory2 as the verified high-count regression anchor before changing event counting, model promotion, or dashboard proof behavior.",
      "blocked_reasons": [
        "dataset_export_not_assembled_for_learning_library_v1"
      ],
      "case_id": "factory2_test_case_1",
      "commands": [
        {
          "command": ".venv/bin/python scripts/start_factory2_demo_stack.py --backend-port 8091 --frontend-port 5173",
          "label": "Run Factory2 verified demo stack",
          "prerequisites": [
            {
              "affects": ["runtime", "validation"],
              "path": "data/videos/from-pc/factory2.MOV",
              "required": true,
              "warn_if_missing": false
            },
            {
              "affects": ["runtime", "validation"],
              "path": "data/calibration/factory2_ai_only_v1.json",
              "required": true,
              "warn_if_missing": false
            }
          ]
        },
        {
          "command": ".venv/bin/python scripts/compare_factory2_app_run_to_truth_ledger.py --observed-events data/reports/factory2_app_observed_events.run8104.visible_dashboard_v1.json --truth-ledger data/reports/factory2_human_truth_ledger.v1.json --output data/reports/factory2_app_vs_truth.run8104.visible_dashboard_v1.json --force",
          "label": "Rebuild Factory2 app-vs-truth comparison",
          "prerequisites": [
            {
              "affects": ["validation", "promotion"],
              "path": "data/reports/factory2_app_observed_events.run8104.visible_dashboard_v1.json",
              "required": true
            },
            {
              "affects": ["validation", "promotion"],
              "path": "data/reports/factory2_human_truth_ledger.v1.json",
              "required": true
            }
          ]
        }
      ],
      "dataset_export": {
        "checks": [
          {
            "id": "gold_event_ledger_present",
            "reason": "Factory2 has a reviewed truth ledger, but no learning-library dataset export is declared in v1.",
            "status": "pass"
          },
          {
            "id": "positive_box_labels_present",
            "reason": "Not declared for learning-library v1.",
            "status": "blocked"
          },
          {
            "id": "source_hashes_present",
            "reason": "Source video hash is present in the manifest.",
            "status": "pass"
          },
          {
            "id": "label_tier_allowed",
            "reason": "Factory2 validation proof uses reviewed truth, not teacher labels.",
            "status": "pass"
          },
          {
            "id": "split_leakage_checked",
            "reason": "No dataset export split is declared in v1.",
            "status": "blocked"
          },
          {
            "id": "permission_ok",
            "reason": "Local/offline case; no cloud upload required.",
            "status": "pass"
          },
          {
            "id": "hard_negatives_reviewed",
            "reason": "No negative-label export declared in v1.",
            "status": "not_applicable"
          }
        ],
        "path": null,
        "state": "blocked"
      },
      "do_not_trust": [
        "Do not claim live Reolink/RTSP field validation from this file-backed demo proof.",
        "Do not replace the visible 1.0x app proof with accelerated diagnostics or timestamp replay.",
        "Do not treat supporting regression runs as the canonical promotion proof."
      ],
      "evidence_refs": [
        {
          "affects": ["runtime", "validation", "promotion"],
          "artifact_id": "visible_app_observed_events",
          "artifact_type": "app_proof_run",
          "authority": "canonical_proof",
          "must_exist": true,
          "notes": "Visible dashboard app path; observed_event_count=23 and run_complete=true.",
          "path": "data/reports/factory2_app_observed_events.run8104.visible_dashboard_v1.json",
          "promotion_eligible": true,
          "runtime_observation_allowed": true,
          "training_eligible": false,
          "validation_truth_eligible": true
        },
        {
          "affects": ["validation", "promotion"],
          "artifact_id": "visible_app_truth_comparison",
          "artifact_type": "comparison_report",
          "authority": "canonical_proof",
          "must_exist": true,
          "notes": "matched_count=23, missing_truth_count=0, unexpected_observed_count=0, first_divergence=null.",
          "path": "data/reports/factory2_app_vs_truth.run8104.visible_dashboard_v1.json",
          "promotion_eligible": true,
          "runtime_observation_allowed": true,
          "training_eligible": false,
          "validation_truth_eligible": true
        },
        {
          "affects": ["validation", "promotion"],
          "artifact_id": "registry_validation_report",
          "artifact_type": "validation_report",
          "authority": "canonical_proof",
          "must_exist": true,
          "notes": "Registry proof summary for the promoted Factory2 test case.",
          "path": "data/reports/factory2_validation_report.registry_v1.json",
          "promotion_eligible": true,
          "runtime_observation_allowed": true,
          "training_eligible": false,
          "validation_truth_eligible": true
        },
        {
          "affects": ["validation"],
          "artifact_id": "human_truth_ledger",
          "artifact_type": "gold_event_ledger",
          "authority": "canonical_proof",
          "must_exist": true,
          "notes": "Reviewed Factory2 truth ledger used by the canonical proof comparison.",
          "path": "data/reports/factory2_human_truth_ledger.v1.json",
          "promotion_eligible": true,
          "runtime_observation_allowed": false,
          "training_eligible": true,
          "validation_truth_eligible": true
        },
        {
          "affects": ["runtime"],
          "artifact_id": "placed_and_stayed_speed8_regression_events",
          "artifact_type": "runtime_diagnostic_run",
          "authority": "supporting_regression",
          "must_exist": true,
          "notes": "Accelerated diagnostic replay of explicit placed_and_stayed selector; counted 23/23 but is not canonical proof.",
          "path": "data/reports/factory2_app_observed_events.run8093.placed_and_stayed_speed8_complete_v1.json",
          "promotion_eligible": false,
          "runtime_observation_allowed": true,
          "training_eligible": false,
          "validation_truth_eligible": false
        },
        {
          "affects": ["runtime"],
          "artifact_id": "placed_and_stayed_speed8_regression_comparison",
          "artifact_type": "comparison_report",
          "authority": "supporting_regression",
          "must_exist": true,
          "notes": "Accelerated regression comparison matched 23/23; useful for engineering confidence only.",
          "path": "data/reports/factory2_app_vs_truth.run8093.placed_and_stayed_speed8_v1.json",
          "promotion_eligible": false,
          "runtime_observation_allowed": true,
          "training_eligible": false,
          "validation_truth_eligible": false
        }
      ],
      "learning_outcome": {
        "blind_prediction_status": "not_applicable_verified_seed_case",
        "detector_transfer_status": "verified_factory2_app_path",
        "expected_total": 23,
        "observed_event_count": 23,
        "registry_promotion_eligible": true
      },
      "manifest_path": "validation/test_cases/factory2.json",
      "privacy_mode": "offline_local",
      "readiness": {
        "promotion": "verified",
        "runtime": "verified",
        "training": "blocked",
        "validation": "verified"
      },
      "related_cases": [
        {
          "case_id": "real_factory_candidate",
          "reason": "Use Factory2 to regression-test placed-and-stayed counting before applying similar semantics to real_factory.",
          "relation": "high_count_regression_anchor"
        }
      ],
      "source_video": {
        "artifact_copy": null,
        "duration_sec": 426.976667,
        "path": "data/videos/from-pc/factory2.MOV",
        "sha256": "f9cd9dcc71cc9e02c0f5a5ba65094510f5ac4cfbe3a39a4eb1e9cae32e69c3d8"
      },
      "status": "verified_app_proof",
      "trust_boundaries": {
        "promotion_eligible": true,
        "runtime_observation_allowed": true,
        "training_eligible": false,
        "validation_truth_eligible": true
      }
    },
    {
      "aliases": ["real_factory"],
      "best_next_action": "Build the reviewed gold event ledger and reviewed positive/hard-negative labels first; then create a real_factory runtime calibration and rerun placed-and-stayed as diagnostic evidence before any promotion attempt.",
      "blocked_reasons": [
        "reviewed_gold_truth_missing",
        "real_factory_runtime_calibration_missing",
        "diagnostic_model_not_promotion_eligible",
        "dataset_export_gates_blocked",
        "no_clean_1x_app_vs_reviewed_truth"
      ],
      "case_id": "real_factory_candidate",
      "commands": [
        {